{
  "schema_version": "1.0",
  "operation_id": "operation-1",
  "phase": "planning",
  "status": "completed",
  "owner_pid": 1,
  "created_at": "2026-09-08T00:00:00+00:00",
  "updated_at": "2026-09-08T00:00:01+00:00",
  "provider_invocation_id": "provider-operation-1",
  "result": {
    "phase": "planning",
    "status": "paused",
    "next_action": "approve_plan",
    "artifacts": {}
  },
  "error": null
}
